{
  "id": "gravenhollow_manor_floor_1",
  "name": "Gravenhollow Manor - Floor 1",
  "region_id": "umberhold",
  "parent_location_id": "gravenhollow_manor",
  "map_type": "dungeon",
  "floor": 0,
  "theme_id": "gravenhollow_manor",
  "grid": {
    "width": 26,
    "height": 26,
    "coordinate_format": "A1-Z26",
    "origin": "top_left",
    "x_axis": "A_to_Z",
    "y_axis": "1_to_26"
  },
  "defaults": {
    "texture_id": "manor_stone_01",
    "floor_texture_id": "manor_floor_flagstone_01",
    "wall_texture_id": "manor_wall_stone_01",
    "ceiling_texture_id": "manor_ceiling_timber_01",
    "ceiling_height": 3,
    "random_encounter_table": "manor_floor_1_random",
    "tags": [
      "interior",
      "manor"
    ]
  },
  "entry_points": [
    {
      "id": "front_door_entry",
      "coord": "E8",
      "facing": "north",
      "notes": "Arrival from the manor exterior."
    },
    {
      "id": "from_crypt_stairs",
      "coord": "N9",
      "facing": "north",
      "notes": "Arrival from the crypt stair below."
    }
  ],
  "tiles": {
    "A1": {
      "is_wall": true
    },
    "A2": {
      "is_wall": true
    },
    "A3": {
      "is_wall": true
    },
    "A4": {
      "is_wall": true
    },
    "A5": {
      "is_wall": true
    },
    "A6": {
      "is_wall": true
    },
    "A7": {
      "is_wall": true
    },
    "A8": {
      "is_wall": true
    },
    "A9": {
      "is_wall": true
    },
    "A10": {
      "is_wall": true
    },
    "A11": {
      "is_wall": true
    },
    "A12": {
      "is_wall": true
    },
    "A13": {
      "is_wall": true
    },
    "A14": {
      "is_wall": true
    },
    "A15": {
      "is_wall": true
    },
    "A16": {
      "is_wall": true
    },
    "A17": {
      "is_wall": true
    },
    "A18": {
      "is_wall": true
    },
    "A19": {
      "is_wall": true
    },
    "A20": {
      "is_wall": true
    },
    "A21": {
      "is_wall": true
    },
    "A22": {
      "is_wall": true
    },
    "A23": {
      "is_wall": true
    },
    "A24": {
      "is_wall": true
    },
    "A25": {
      "is_wall": true
    },
    "A26": {
      "is_wall": true
    },
    "B1": {
      "is_wall": true
    },
    "B2": {
      "is_wall": true
    },
    "B3": {
      "is_wall": true
    },
    "B4": {
      "is_wall": true
    },
    "B5": {
      "is_wall": true
    },
    "B6": {
      "is_wall": true
    },
    "B7": {
      "is_wall": true
    },
    "B8": {
      "is_wall": true
    },
    "B9": {
      "is_wall": true
    },
    "B10": {
      "is_wall": true
    },
    "B11": {
      "is_wall": true
    },
    "B12": {
      "is_wall": true
    },
    "B13": {
      "is_wall": true
    },
    "B14": {
      "is_wall": true
    },
    "B15": {
      "is_wall": true
    },
    "B16": {
      "is_wall": true
    },
    "B17": {
      "is_wall": true
    },
    "B18": {
      "is_wall": true
    },
    "B19": {
      "is_wall": true
    },
    "B20": {
      "is_wall": true
    },
    "B21": {
      "is_wall": true
    },
    "B22": {
      "is_wall": true
    },
    "B23": {
      "is_wall": true
    },
    "B24": {
      "is_wall": true
    },
    "B25": {
      "is_wall": true
    },
    "B26": {
      "is_wall": true
    },
    "C1": {
      "is_wall": true
    },
    "C2": {
      "is_wall": true
    },
    "C3": {
      "is_wall": true
    },
    "C4": {
      "is_wall": true
    },
    "C5": {
      "is_wall": true
    },
    "C6": {
      "is_wall": true
    },
    "C7": {
      "is_wall": true
    },
    "C8": {
      "is_wall": true
    },
    "C9": {
      "is_wall": true
    },
    "C10": {
      "is_wall": true
    },
    "C11": {
      "is_wall": true
    },
    "C12": {
      "is_wall": true
    },
    "C13": {
      "is_wall": true
    },
    "C14": {
      "is_wall": true
    },
    "C15": {
      "is_wall": true
    },
    "C16": {
      "is_wall": true
    },
    "C17": {
      "is_wall": true
    },
    "C18": {
      "is_wall": true
    },
    "C19": {
      "is_wall": true
    },
    "C20": {
      "is_wall": true
    },
    "C21": {
      "is_wall": true
    },
    "C22": {
      "is_wall": true
    },
    "C23": {
      "is_wall": true
    },
    "C24": {
      "is_wall": true
    },
    "C25": {
      "is_wall": true
    },
    "C26": {
      "is_wall": true
    },
    "D1": {
      "is_wall": true
    },
    "D2": {
      "is_wall": true
    },
    "D3": {
      "is_wall": true
    },
    "D4": {
      "is_wall": false,
      "height": 0,
      "tags": [
        "interior",
        "dungeon",
        "manor"
      ],
      "encounter_table": "manor_floor_1_random"
    },
    "D5": {
      "is_wall": false,
      "height": 0,
      "tags": [
        "interior",
        "dungeon",
        "manor"
      ],
      "encounter_table": "manor_floor_1_random"
    },
    "D6": {
      "is_wall": false,
      "height": 0,
      "tags": [
        "interior",
        "dungeon",
        "manor"
      ],
      "encounter_table": "manor_floor_1_random"
    },
    "D7": {
      "is_wall": false,
      "height": 0,
      "tags": [
        "interior",
        "dungeon",
        "manor"
      ],
      "encounter_table": "manor_floor_1_random"
    },
    "D8": {
      "is_wall": false,
      "height": 0,
      "tags": [
        "interior",
        "dungeon",
        "manor"
      ],
      "encounter_table": "manor_floor_1_random"
    },
    "D9": {
      "is_wall": true
    },
    "D10": {
      "is_wall": true
    },
    "D11": {
      "is_wall": true
    },
    "D12": {
      "is_wall": true
    },
    "D13": {
      "is_wall": true
    },
    "D14": {
      "is_wall": true
    },
    "D15": {
      "is_wall": true
    },
    "D16": {
      "is_wall": true
    },
    "D17": {
      "is_wall": true
    },
    "D18": {
      "is_wall": true
    },
    "D19": {
      "is_wall": true
    },
    "D20": {
      "is_wall": true
    },
    "D21": {
      "is_wall": true
    },
    "D22": {
      "is_wall": true
    },
    "D23": {
      "is_wall": true
    },
    "D24": {
      "is_wall": true
    },
    "D25": {
      "is_wall": true
    },
    "D26": {
      "is_wall": true
    },
    "E1": {
      "is_wall": true
    },
    "E2": {
      "is_wall": true
    },
    "E3": {
      "is_wall": true
    },
    "E4": {
      "is_wall": false,
      "height": 0,
      "tags": [
        "interior",
        "dungeon",
        "manor"
      ],
      "encounter_table": "manor_floor_1_random"
    },
    "E5": {
      "is_wall": false,
      "height": 0,
      "tags": [
        "interior",
        "dungeon",
        "manor"
      ],
      "encounter_table": "manor_floor_1_random"
    },
    "E6": {
      "is_wall": false,
      "height": 0,
      "tags": [
        "interior",
        "dungeon",
        "manor"
      ],
      "encounter_table": "manor_floor_1_random"
    },
    "E7": {
      "is_wall": false,
      "height": 0,
      "tags": [
        "interior",
        "dungeon",
        "manor"
      ],
      "encounter_table": "manor_floor_1_random"
    },
    "E8": {
      "is_wall": false,
      "height": 0,
      "tags": [
        "interior",
        "dungeon",
        "manor",
        "safe_entry"
      ],
      "encounter_table": null,
      "step_trigger_ids": [
        "manor_entry_intro"
      ]
    },
    "E9": {
      "is_wall": true
    },
    "E10": {
      "is_wall": true
    },
    "E11": {
      "is_wall": true
    },
    "E12": {
      "is_wall": true
    },
    "E13": {
      "is_wall": true
    },
    "E14": {
      "is_wall": true
    },
    "E15": {
      "is_wall": true
    },
    "E16": {
      "is_wall": true
    },
    "E17": {
      "is_wall": true
    },
    "E18": {
      "is_wall": true
    },
    "E19": {
      "is_wall": true
    },
    "E20": {
      "is_wall": true
    },
    "E21": {
      "is_wall": true
    },
    "E22": {
      "is_wall": true
    },
    "E23": {
      "is_wall": true
    },
    "E24": {
      "is_wall": true
    },
    "E25": {
      "is_wall": true
    },
    "E26": {
      "is_wall": true
    },
    "F1": {
      "is_wall": true
    },
    "F2": {
      "is_wall": true
    },
    "F3": {
      "is_wall": true
    },
    "F4": {
      "is_wall": false,
      "height": 0,
      "tags": [
        "interior",
        "dungeon",
        "manor"
      ],
      "encounter_table": "manor_floor_1_random"
    },
    "F5": {
      "is_wall": false,
      "height": 0,
      "tags": [
        "interior",
        "dungeon",
        "manor"
      ],
      "encounter_table": "manor_floor_1_random"
    },
    "F6": {
      "is_wall": false,
      "height": 0,
      "tags": [
        "interior",
        "dungeon",
        "manor"
      ],
      "encounter_table": "manor_floor_1_random"
    },
    "F7": {
      "is_wall": false,
      "height": 0,
      "tags": [
        "interior",
        "dungeon",
        "manor"
      ],
      "encounter_table": "manor_floor_1_random"
    },
    "F8": {
      "is_wall": false,
      "height": 0,
      "tags": [
        "interior",
        "dungeon",
        "manor",
        "safe_entry"
      ],
      "encounter_table": null
    },
    "F9": {
      "is_wall": true
    },
    "F10": {
      "is_wall": true
    },
    "F11": {
      "is_wall": true
    },
    "F12": {
      "is_wall": true
    },
    "F13": {
      "is_wall": true
    },
    "F14": {
      "is_wall": true
    },
    "F15": {
      "is_wall": true
    },
    "F16": {
      "is_wall": true
    },
    "F17": {
      "is_wall": true
    },
    "F18": {
      "is_wall": true
    },
    "F19": {
      "is_wall": true
    },
    "F20": {
      "is_wall": true
    },
    "F21": {
      "is_wall": true
    },
    "F22": {
      "is_wall": true
    },
    "F23": {
      "is_wall": true
    },
    "F24": {
      "is_wall": true
    },
    "F25": {
      "is_wall": true
    },
    "F26": {
      "is_wall": true
    },
    "G1": {
      "is_wall": true
    },
    "G2": {
      "is_wall": true
    },
    "G3": {
      "is_wall": true
    },
    "G4": {